url,contenu
https://example.com/seo,Le référencement naturel (SEO) est l'ensemble des techniques visant à optimiser la visibilité d'un site web dans les résultats des moteurs de recherche. Il s'agit d'améliorer le positionnement pour générer du trafic qualifié et augmenter la notoriété.
https://example.com/social,Les réseaux sociaux sont devenus incontournables dans toute stratégie marketing digital. Facebook, Instagram, LinkedIn et Twitter permettent de toucher différentes audiences et de créer une communauté engagée autour de votre marque.
https://example.com/ads,La publicité en ligne via Google Ads et Facebook Ads permet de cibler précisément votre audience et d'obtenir des résultats rapidement. Ces plateformes offrent un excellent ROI quand elles sont bien optimisées.
https://example.com/content,Le content marketing consiste à créer et diffuser du contenu pertinent pour attirer et fidéliser une audience clairement définie. La rédaction web, le blogging et la stratégie de contenu sont essentiels pour convertir les visiteurs.
https://example.com/ecommerce,L'e-commerce ou commerce électronique désigne la vente en ligne de biens ou services. Les plateformes comme Shopify et WooCommerce facilitent la création de boutiques en ligne avec des solutions de paiement sécurisées et une gestion logistique intégrée.
https://example.com/webdesign,L'UX design (expérience utilisateur) et le responsive design sont cruciaux pour offrir une navigation fluide sur tous les appareils. Un site bien conçu améliore le taux de conversion et réduit le taux de rebond.
